{
  "workspace_id": "app",
  "job_id": "job_example",
  "attempt_id": "att_example",
  "observed_at": "2026-10-13T00:00:00Z",
  "eligible": true,
  "reason": "eligible",
  "resources": [
    {
      "resource_id": "res_execution_example",
      "purpose": "execution",
      "target_sha256": "aaaaaaaaaaaaaaaaaaaaaaaaaaaaaaaaaaaaaaaaaaaaaaaaaaaaaaaaaaaaaaaa",
      "target": {
        "kind": "kernel",
        "id": "123456",
        "name": "operator/cre-example",
        "version": "1",
        "scope": "kernel_object",
        "support": "supported",
        "reason": "recorded_attempt_resource",
        "bytes": null
      },
      "eligible": true,
      "observation": "present",
      "reason": "eligible"
    }
  ]
}
